{"actor_identity":"qc2-011-runner","authorized_command_ref":null,"content_hash":"d17915f89a8c5e9eb760ad6514192d8816792b265a16e7cc7085e8438eaa4293","correlation_id":"qc2-011-01a11864-f817-7e23-8698-e922d3f7e3bf","created_at":"2026-10-07T22:03:52Z","dependency_refs":[],"environment_namespace":"production","event_hash":"ad88918a5d5170bdfdeaecd865443100b3946f3c0660b70da99315f8a20c6105","event_type":"diagnostic_asset_observation","evidence_class":"FORWARD_OPERATIONAL","id":"01a11864-f817-77c0-9435-6923e03d5f52","installation_id":"qc2-011-capture","monotonic_generation":0,"owning_authority":"evidence","payload_hash":"94165d6e51e60214ef15876a4e2e063a131351f033b542eb0fcf93166ec03fda","previous_event_hash":null,"schema_name":"qc2.integrity_build.EvidenceEvent.v1","schema_version":"1.0","sequence":1,"source_refs":[],"stream_id":"qc2-011-01a11864-f817-7e23-8698-e922d3f7e3bf","wall_clock_at":"2026-10-07T22:03:52Z"}